{
  "schema_version": "tscb.dataset-manifest.v2",
  "key": "exchange_rate",
  "display_name": "Exchange rate multivariate time series",
  "source": {"uri": "local:datasets/exchange_rate.csv", "retrieved_at": "UNSPECIFIED"},
  "license": {"spdx": "UNSPECIFIED", "status": "REVIEW_REQUIRED"},
  "file": {
    "path": "datasets/exchange_rate.csv", "bytes": 637800,
    "sha256": "48b4d9d3d508f5104162e85b9a6042e3557fde11aa9f2944eba8c0d0efc89842",
    "format": "csv",
    "header_bytes_sha256": "a2167faf6eeebe90b44f643881f0aa5a1b8aaa6a12d9d5865fd41ab9bde2c780"
  },
  "parser": {
    "name": "python.csv", "version": "stdlib-runtime-recorded", "encoding": "utf-8",
    "encoding_errors": "strict", "delimiter": ",", "decimal": ".", "header": true,
    "strict_column_count": true
  },
  "logical": {
    "topology": "SYNCHRONOUS_MTS", "axes": ["time", "entity"],
    "timestamp": {
      "origin": "SOURCE_COLUMN", "column": "date", "dtype": "<i8", "unit": "s",
      "epoch": "UNIX", "formats": ["%Y/%m/%d %H:%M"],
      "timezone_interpretation": "NAIVE_AS_UTC", "order_policy": "PRESERVE",
      "allow_duplicates": false, "allow_out_of_order": false
    },
    "value": {
      "kind": "CSV_COLUMNS",
      "column_selection": {"kind": "ALL_EXCEPT", "excluded": ["date"], "expected_count": 8},
      "default_column": {"dtype": "<f8", "unit": "UNSPECIFIED", "entity": "$HEADER", "feature": "exchange_rate"},
      "overrides": {}, "display_name_overrides": {}, "representation": "PER_COLUMN_BUFFERS"
    },
    "validity": {"shape": "NONE", "missing_tokens": [], "nan_is_null": false},
    "canonical": {"format_version": "tscb-canonical-v1", "byte_order": "little"}
  },
  "expected": {"rows": 7588, "columns": 9},
  "split": {"policy": "UNSPECIFIED", "learned_eligible": false, "reason": "No evidence-backed split was supplied"}
}

