{
  "schema_version": "tscb.dataset-manifest.v2",
  "key": "pems03",
  "display_name": "PEMS03 sensor tensor",
  "source": {"uri": "local:datasets/PEMS03.npz", "retrieved_at": "UNSPECIFIED"},
  "license": {"spdx": "UNSPECIFIED", "status": "REVIEW_REQUIRED"},
  "file": {
    "path": "datasets/PEMS03.npz", "bytes": 15800415,
    "sha256": "34859517425eded66a0014db63de54b95d0428c38890741a1710ed4d3b043de8",
    "format": "npz"
  },
  "parser": {
    "name": "numpy.npz", "version": "runtime-recorded", "allow_pickle": false,
    "array_key": "data", "expected_keys": ["data"]
  },
  "logical": {
    "topology": "NATIVE_ND_ARRAY", "axes": ["time", "sensor", "feature"],
    "timestamp": {"origin": "NONE", "reason": "Source archive contains no timestamp array or evidence-backed construction rule"},
    "value": {
      "kind": "NPZ_ARRAY",
      "array": {"dtype": "<f8", "unit": "UNSPECIFIED", "entity": "sensor-axis", "feature": "feature-axis", "required_layout": "ROW_MAJOR_CONTIG"},
      "representation": "NATIVE_ND_PRESERVED"
    },
    "validity": {"shape": "NONE", "missing_tokens": [], "nan_is_null": false},
    "canonical": {"format_version": "tscb-canonical-v1", "byte_order": "little"}
  },
  "expected": {"shape": [26208, 358, 1], "dtype": "<f8", "array_keys": ["data"]},
  "split": {"policy": "UNSPECIFIED", "learned_eligible": false, "reason": "No evidence-backed split was supplied"}
}

